Headline,Detailed,stock_affected,impact
Interest Rate Hike,Venture capitalists are reportedly becoming more cautious about funding new tech startups as rumors of potential interest rate hikes circulate. Will the flow of investment dry up?,1,-0.15
Slowing Price Growth,Prices for consumer electronics are stabilizing after a period of rapid increases. Is this a sign of weakening demand or a return to normal market conditions?,1,0.03
Mixed Economic Data,"While software companies are reporting strong earnings, hardware manufacturers are struggling. Is the tech sector experiencing a bifurcation?",1,0
Shift in Consumer Preferences,Consumers are increasingly interested in privacy-focused/open-source/AI-powered devices. Established tech giants are scrambling to adapt.,1,0.6
New Technology Emerges,A breakthrough in AI/quantum computing/battery technology is announced. This could revolutionize various industries and create new market opportunities.,1,0.8
Merger Rumors Circulate,Rumors are circulating that two major tech companies are considering a merger. This could create a dominant player in the market and raise concerns about antitrust issues.,1,-0.1
Global Financial Crises,"A global credit crunch dries up venture capital funding, causing numerous tech startups to fail. Large tech companies see significant drops in revenue and stock prices.",1,-4.5
Global Climate Change,"Climate change drives demand for new technologies related to climate monitoring, energy efficiency, and disaster management. Tech companies invest in sustainable practices and carbon reduction initiatives.",1,-1
Global Resource Scarcity,A shortage of rare earth minerals or semiconductors can disrupt the production of electronic devices and increase prices.,1,-2.8
Sudden Collapse of Global Bank,"Rumors of significant instability within a major financial institution are causing concern among tech investors, raising questions about access to capital and market stability.",1,-7.5
A Large-Scale Terrorist Attack with Global Consequences,A major security incident is impacting global communication networks and raising concerns about cybersecurity vulnerabilities.,1,-5
A Sudden and Unexpected Technological Breakthrough,"Rumors of a major breakthrough in a core technology are circulating, with potential to reshape the tech landscape.",1,6
New Immersive Experience Hits the Market,"A tech company has launched a new virtual/augmented reality headset, promising a revolutionary immersive experience. Early reviews are mixed, with some praising its innovative features and others citing concerns about price and practicality.",1,0.3
Personal AI Assistant Promises to Streamline Daily Life," new AI-powered personal assistant software has been released, promising to automate tasks and improve productivity. However, concerns about data privacy and the potential for job displacement are being raised.",1,0.2
Next-Generation Foldable Device Unveiled,"A major tech company has unveiled its latest foldable smartphone, boasting advanced features and improved durability. However, the high price tag and limited availability are raising questions about its market appeal.",1,0.1
Pop Sensation Goes Off-Grid,"A globally renowned pop star has announced they are taking an extended break from social media and all digital devices, citing a need for 'digital detox.' The impact on wider tech adoption remains to be seen.",1,0
Tech Titans Star in New Reality Series,"A new reality TV show featuring prominent tech entrepreneurs has premiered, generating significant buzz and controversy. The show's portrayal of the tech industry is sparking debate.",1,0
Legendary Rock Band Announces Surprise Reunion Tour,A beloved classic rock band has announced a surprise reunion tour after decades apart. The news is generating excitement among music fans worldwide.,1,0